Job Title,Company,Location,Link,Description,Salary,Clean_Description,Skills
Data Analyst,Hsbc,Hyderabad,https://www.naukri.com/job-listings-data-analyst-hsbc-electronic-data-processing-india-pvt-ltd-hyderabad-0-to-4-years-150725501930,"Some careers have more impact than others.
If you re looking for a career where you can make a real impression, join HSBC and discover how valued you ll be.
HSBC is one of the largest banking and financial services organisations in the world, with operations in 62 countries and territories. We aim to be where the growth is, enabling businesses to thrive and economies to prosper, and, ultimately, helping people to fulfil their hopes and realise their ambitions.
We are currently seeking an experienced professional to join our team in the role of Data Analyst
Principal responsibilities
Performing exploratory data analysis across one or multiple data domains / business subject areas to understand the data s structure and relationships that would support business data requirements.
Perform queries on data platforms to validate analysis / hypothesis and ensure good quality / trusted data are being identified for the business.
Collaborate with upstream data domain / data platform owners to source trusted enterprise-level data, ensuring good quality data is provisioned downstream.
Participate in agile ceremonies within the assigned pods, adopting agile ways of working and best practices.
Ensure deliverables meet data governance standards, such as data accuracy, data lineage transparency, data consistency and security.
Understand, follow and demonstrate compliance with all relevant internal and external rules, regulations and procedures that apply to the conduct of the business in which you are involved, specifically Internal Controls and any Compliance policy including, inter alia, the Group Compliance policy.
Maintain HSBC Internal Control standards, including the timely implementation of internal and external audit points together with any issues raised by external regulators. Be aware of the Operational Risk scenario associated with your role and act in a manner that takes account of operational risk considerations.
This is non-contractual and is intended only as a summary of your role and responsibilities from time to time. This document will be subject to review by you and your line manager as appropriate during the course of your employment.
The jobholder will continually reassess the operational risks associated with the role and inherent in the business, taking account of changing legal and regulatory requirements, operating procedures and practices, management restructurings, and the impact of new technology
This will be achieved by ensuring all actions take into account the likelihood of operational risk events, and by addressing any areas of concern in conjunction with line management and/or the appropriate department. The role will implement the Operational Risk control framework and per the BRCMs Three Lines of Defence










Requirements



University degree in relevant disciplines.
Strong analytical and problem-solving skills.
Experience working within the Hadoop and GCP ecosystems in addition to strong technical skills in analytical languages such as Python, R, SQL, SAS.
Good understanding of banking operations and processes, preferably in Risk, Compliance and Finance functions.
Proven experience working in Agile environments (Kanban / Scrum) and familiarity with Agile tools like JIRA, Confluence, MS Teams & SharePoint.
Excellent stakeholder engagement and management skills. Ability to navigate within the organization
Proficient skills in MS Excel and PowerPoint.
You ll achieve more at HSBC
HSBC is an equal opportunity employer committed to building a culture where all employees are valued, respected and opinions count. We take pride in providing a workplace that fosters continuous professional development, flexible working and, opportunities to grow within an inclusive and diverse environment. We encourage applications from all suitably qualified persons irrespective of, but not limited to, their gender or genetic information, sexual orientation, ethnicity, religion, social status, medical care leave requirements, political affiliation, people with disabilities, color, national origin, veteran status, etc. , We consider all applications based on merit and suitability to the role.
Personal data held by the Bank relating to employment applications will be used in accordance with our Privacy Statement, which is available on our website.",Avg. salary - 10.7 LPA,"some careers have more impact than others
if you re looking for a career where you can make a real impression join hsbc and discover how valued you ll be
hsbc is one of the largest banking and financial services organisations in the world with operations in  countries and territories we aim to be where the growth is enabling businesses to thrive and economies to prosper and ultimately helping people to fulfil their hopes and realise their ambitions
we are currently seeking an experienced professional to join our team in the role of data analyst
principal responsibilities
performing exploratory data analysis across one or multiple data domains  business subject areas to understand the data s structure and relationships that would support business data requirements
perform queries on data platforms to validate analysis  hypothesis and ensure good quality  trusted data are being identified for the business
collaborate with upstream data domain  data platform owners to source trusted enterpriselevel data ensuring good quality data is provisioned downstream
participate in agile ceremonies within the assigned pods adopting agile ways of working and best practices
ensure deliverables meet data governance standards such as data accuracy data lineage transparency data consistency and security
understand follow and demonstrate compliance with all relevant internal and external rules regulations and procedures that apply to the conduct of the business in which you are involved specifically internal controls and any compliance policy including inter alia the group compliance policy
maintain hsbc internal control standards including the timely implementation of internal and external audit points together with any issues raised by external regulators be aware of the operational risk scenario associated with your role and act in a manner that takes account of operational risk considerations
this is noncontractual and is intended only as a summary of your role and responsibilities from time to time this document will be subject to review by you and your line manager as appropriate during the course of your employment
the jobholder will continually reassess the operational risks associated with the role and inherent in the business taking account of changing legal and regulatory requirements operating procedures and practices management restructurings and the impact of new technology
this will be achieved by ensuring all actions take into account the likelihood of operational risk events and by addressing any areas of concern in conjunction with line management andor the appropriate department the role will implement the operational risk control framework and per the brcms three lines of defence










requirements



university degree in relevant disciplines
strong analytical and problemsolving skills
experience working within the hadoop and gcp ecosystems in addition to strong technical skills in analytical languages such as python r sql sas
good understanding of banking operations and processes preferably in risk compliance and finance functions
proven experience working in agile environments kanban  scrum and familiarity with agile tools like jira confluence ms teams  sharepoint
excellent stakeholder engagement and management skills ability to navigate within the organization
proficient skills in ms excel and powerpoint
you ll achieve more at hsbc
hsbc is an equal opportunity employer committed to building a culture where all employees are valued respected and opinions count we take pride in providing a workplace that fosters continuous professional development flexible working and opportunities to grow within an inclusive and diverse environment we encourage applications from all suitably qualified persons irrespective of but not limited to their gender or genetic information sexual orientation ethnicity religion social status medical care leave requirements political affiliation people with disabilities color national origin veteran status etc  we consider all applications based on merit and suitability to the role
personal data held by the bank relating to employment applications will be used in accordance with our privacy statement which is available on our website","['python', 'sql', 'excel']"
Data Analyst - Fraud,Visa,Bengaluru,https://www.naukri.com/job-listings-data-analyst-fraud-visa-inc-bengaluru-2-to-3-years-190725501375,"This position will support the Anomaly Detection Platforms (ADP) team and help drive several of Visa s most important and high-visibility fraud deterrence and compliance enablement projects within Global Risk team at Visa. This fast-paced team of technology experts identifies, investigates, disrupts and prevents compliance breaches and fraud attacks targeting the global payment ecosystem. This data and analytics team is working closely with the Visa Direct team to identify non-compliance across money-movement merchants and their acquiring banks leveraging advanced analytics and data science techniques. Key measures of success for this position include the ability to develop and automate key data intelligence capabilities that optimize detection of Visa Direct acquirer & merchant non-compliance activities, the development of advanced metrics that evaluate the non-compliance risk of key clients, and automated reporting at scale for business enforcement. The solutions developed under this role will lead to measurable improvement in Visa Direct s transactional data integrity and streamlined operations of Visa Direct business.
The Primary responsibilities for this role will include:
Lead the design and production deployment of new and advanced techniques to recognize non-compliance in Visa Direct AFT and OCT transactions including peer-to-peer transfers, wallet loads, account funding, money transfers, etc.
Manage non-compliance detection taxonomies and thresholds that optimize true positive detections.
Analyze complex financial data to uncover patterns, anomalies, and insights that support risk assessment and non-compliance identification.
Collaborate closely with issuing and acquiring clients to understand their specific risk and fraud challenges, providing expert guidance and tailoring solutions to their needs.
Provide data analysis to provide evidence against non-compliance in merchant registration and operations.
Continuously question and consider new techniques to stay ahead of key money movement trends.
Assist in the coordinated compilation and delivery of reporting, briefings, and other related communication products to Visa management.
Collaborate with Technology partners to enhance detection capabilities for improved insights and pattern detection.
SECONDARY RESPONSIBILITIES:
Develop customized monitoring solutions to enable clients to take proactive action during merchant registration to avoid non-compliance at source.
Support the development of data-led cybercrime and fraud prevention initiatives including point-of-sale (card present/card not present) terminal fraud, anomalous cross-border volumes, Purchase Return Authorization fraud, data manipulation attacks, and ATM Cashouts.
Provide intelligence and technical analysis support to the Global Risk organization to further protect the payment ecosystem.
Create detailed documentation for all the Visa Direct analytics solutions.
Communicate openly with the Visa Direct team and act as an SME and point of escalation.
Develop a plan to partner and gather intelligence details from acquirers for all source analysis.
This is a hybrid position. Expectation of days in office will be confirmed by your Hiring Manager.


REQUIRED EXPERIENCE :
2 to 3 years of work experience (preferably in payments industry) with a Bachelors Degree or an Advanced Degree (e.g. Masters, MBA, or PhD
Ability to conduct com",Not Mentioned,"this position will support the anomaly detection platforms adp team and help drive several of visa s most important and highvisibility fraud deterrence and compliance enablement projects within global risk team at visa this fastpaced team of technology experts identifies investigates disrupts and prevents compliance breaches and fraud attacks targeting the global payment ecosystem this data and analytics team is working closely with the visa direct team to identify noncompliance across moneymovement merchants and their acquiring banks leveraging advanced analytics and data science techniques key measures of success for this position include the ability to develop and automate key data intelligence capabilities that optimize detection of visa direct acquirer  merchant noncompliance activities the development of advanced metrics that evaluate the noncompliance risk of key clients and automated reporting at scale for business enforcement the solutions developed under this role will lead to measurable improvement in visa direct s transactional data integrity and streamlined operations of visa direct business
the primary responsibilities for this role will include
lead the design and production deployment of new and advanced techniques to recognize noncompliance in visa direct aft and oct transactions including peertopeer transfers wallet loads account funding money transfers etc
manage noncompliance detection taxonomies and thresholds that optimize true positive detections
analyze complex financial data to uncover patterns anomalies and insights that support risk assessment and noncompliance identification
collaborate closely with issuing and acquiring clients to understand their specific risk and fraud challenges providing expert guidance and tailoring solutions to their needs
provide data analysis to provide evidence against noncompliance in merchant registration and operations
continuously question and consider new techniques to stay ahead of key money movement trends
assist in the coordinated compilation and delivery of reporting briefings and other related communication products to visa management
collaborate with technology partners to enhance detection capabilities for improved insights and pattern detection
secondary responsibilities
develop customized monitoring solutions to enable clients to take proactive action during merchant registration to avoid noncompliance at source
support the development of dataled cybercrime and fraud prevention initiatives including pointofsale card presentcard not present terminal fraud anomalous crossborder volumes purchase return authorization fraud data manipulation attacks and atm cashouts
provide intelligence and technical analysis support to the global risk organization to further protect the payment ecosystem
create detailed documentation for all the visa direct analytics solutions
communicate openly with the visa direct team and act as an sme and point of escalation
develop a plan to partner and gather intelligence details from acquirers for all source analysis
this is a hybrid position expectation of days in office will be confirmed by your hiring manager


required experience 
 to  years of work experience preferably in payments industry with a bachelors degree or an advanced degree eg masters mba or phd
ability to conduct com",['analytics']
