Job Title,Company,Location,Link,Description,Salary,Clean_Description,Skills
Data Analyst,Cummins,Pune,https://www.naukri.com/job-listings-data-analyst-cummins-india-ltd-pune-2-to-6-years-040725920325,"DESCRIPTION
Key Responsibilities:
Conduct descriptive and diagnostic analytics on data sources.
Apply machine learning tools on data and metadata to improve data quality.
Identify patterns and trends in data sets.
Create reports and dashboards on analysis results using business intelligence technologies.
Develop data profiles for data tables and elements in the data lake.
Create data catalog entries and ensure data catalog metadata quality.
Analyze diverse data sets to identify data quality, coherency, and integrability issues and reduce data redundancy.
Collaborate to develop data cleansing methods and rules.
Assist in the creation and maintenance of documentation of key decisions, rules, controls, and processes.
RESPONSIBILITIES
Qualifications:
College, university, or equivalent degree in relevant technical discipline, or relevant equivalent experience required.
This position may require licensing for compliance with export controls or sanctions regulations.
Competencies:
Action Oriented: Taking on new opportunities and tough challenges with a sense of urgency, high energy, and enthusiasm.
Communicates Effectively: Developing and delivering multi-mode communications that convey a clear understanding of the unique needs of different audiences.
Customer Focus: Building strong customer relationships and delivering customer-centric solutions.
Tech Savvy: Anticipating and adopting innovations in business-building digital and technology applications.
Data Analytics: Discovering, interpreting, and communicating qualitative and quantitative data; determining conclusions relying on knowledge of business or functional frameworks; simultaneously applying statistics, data validity, data visualization, and problem-solving approaches to effectively extract meaningful patterns and business insights; presenting conclusions and outcomes that enable data-driven business decisions.
Data Communication and Visualization: Constructing a tale of the business problem, root cause, solution options, and opportunities through illustrating data visually, including reports and dashboards.
Data Literacy: Expressing data in context, including data sources and constructs, analytical methods, and applied techniques; describing the use-case application and resulting value.
Data Profiling: Assessing data issues and cleansing requirements to perform data extraction, mapping, collection, and testing; establishing good, quality data.
Data Quality: Identifying, understanding, and correcting flaws in data that supports effective information governance across operational business processes and decision-making.
Values Differences: Recognizing the value that different perspectives and cultures bring to an organization.
QUALIFICATIONS
Skills:
Demonstrated experience as a Data Analyst or in a related data-centric role.
Proficiency in SQL (preferably SQL Server) for querying and manipulating data.
Practical experience with Databricks for tasks related to data engineering, data science, and analytics.
Experience working with Databricks Lakehouse architecture and data warehousing concepts.
Knowledge of Azure cloud services, including Azure Data Factory and Azure SQL Database.
Expertise in Python programming.
Skilled in using PowerBI to create interactive reports, dashboards, and visualizations, with familiarity in SSAS models.
Strong analytical mindset with excellent problem-solving skills and keen attention to detail.
Good communication skills, capable of conveying complex data insights clearly to non-technical stakeholders.
Experience:
Relevant experience preferred such as working in a temporary student employment, intern, co-op, or other extracurricular team activities.
Knowledge of the latest technologies and trends in data science is highly preferred and includes:
SQL query language execution on NoSQL and SQL sources.
Exposure to Agile software development.
Exposure to IoT technology.
Data profiling tools, technologies, and coding.
Data catalog tools and technologies.
Business intelligence tools and technologies.
Exposure to Big Data open source.
Clustered compute cloud-based implementation experience.",Avg. salary - 9.7 LPA,"description
key responsibilities
conduct descriptive and diagnostic analytics on data sources
apply machine learning tools on data and metadata to improve data quality
identify patterns and trends in data sets
create reports and dashboards on analysis results using business intelligence technologies
develop data profiles for data tables and elements in the data lake
create data catalog entries and ensure data catalog metadata quality
analyze diverse data sets to identify data quality coherency and integrability issues and reduce data redundancy
collaborate to develop data cleansing methods and rules
assist in the creation and maintenance of documentation of key decisions rules controls and processes
responsibilities
qualifications
college university or equivalent degree in relevant technical discipline or relevant equivalent experience required
this position may require licensing for compliance with export controls or sanctions regulations
competencies
action oriented taking on new opportunities and tough challenges with a sense of urgency high energy and enthusiasm
communicates effectively developing and delivering multimode communications that convey a clear understanding of the unique needs of different audiences
customer focus building strong customer relationships and delivering customercentric solutions
tech savvy anticipating and adopting innovations in businessbuilding digital and technology applications
data analytics discovering interpreting and communicating qualitative and quantitative data determining conclusions relying on knowledge of business or functional frameworks simultaneously applying statistics data validity data visualization and problemsolving approaches to effectively extract meaningful patterns and business insights presenting conclusions and outcomes that enable datadriven business decisions
data communication and visualization constructing a tale of the business problem root cause solution options and opportunities through illustrating data visually including reports and dashboards
data literacy expressing data in context including data sources and constructs analytical methods and applied techniques describing the usecase application and resulting value
data profiling assessing data issues and cleansing requirements to perform data extraction mapping collection and testing establishing good quality data
data quality identifying understanding and correcting flaws in data that supports effective information governance across operational business processes and decisionmaking
values differences recognizing the value that different perspectives and cultures bring to an organization
qualifications
skills
demonstrated experience as a data analyst or in a related datacentric role
proficiency in sql preferably sql server for querying and manipulating data
practical experience with databricks for tasks related to data engineering data science and analytics
experience working with databricks lakehouse architecture and data warehousing concepts
knowledge of azure cloud services including azure data factory and azure sql database
expertise in python programming
skilled in using powerbi to create interactive reports dashboards and visualizations with familiarity in ssas models
strong analytical mindset with excellent problemsolving skills and keen attention to detail
good communication skills capable of conveying complex data insights clearly to nontechnical stakeholders
experience
relevant experience preferred such as working in a temporary student employment intern coop or other extracurricular team activities
knowledge of the latest technologies and trends in data science is highly preferred and includes
sql query language execution on nosql and sql sources
exposure to agile software development
exposure to iot technology
data profiling tools technologies and coding
data catalog tools and technologies
business intelligence tools and technologies
exposure to big data open source
clustered compute cloudbased implementation experience","['python', 'sql', 'excel', 'machine learning', 'data visualization', 'statistics', 'analytics', 'dash', 'big data', 'aws']"
Data Analyst,Michelin,Pune,https://www.naukri.com/job-listings-data-analyst-michelin-manufacturing-pune-2-to-5-years-170725501949,"Data Analyst
- - - - - - - - - - - -
The e-Retail Digital Marketing Analyst position involves working directly with a dynamic team of eRetail business analysts based in Lyon, France, as they assist internal business partners in developing e-Retail strategies to achieve Michelin business goals.
Tracks, measures, analyzes trends of the eRetail execution of Michelin tyre products on identified e-Commerce websites, with a focus on defined KPIs
Understands e-Retail business requirements and how to map those requirements to specific distributor relationships contexts",Not Mentioned,"data analyst
           
the eretail digital marketing analyst position involves working directly with a dynamic team of eretail business analysts based in lyon france as they assist internal business partners in developing eretail strategies to achieve michelin business goals
tracks measures analyzes trends of the eretail execution of michelin tyre products on identified ecommerce websites with a focus on defined kpis
understands eretail business requirements and how to map those requirements to specific distributor relationships contexts",[]
Data Analyst,NTT DATA Business Solutions,Bengaluru,https://www.naukri.com/job-listings-data-analyst-ntt-data-bengaluru-0-to-5-years-250625501149,"Req ID: 327858
NTT DATA strives to hire exceptional, innovative and passionate individuals who want to grow with us. If you want to be part of an inclusive, adaptable, and forward-thinking organization, apply now.
We are currently seeking a Data Analyst to join our team in Bangalore, Karn taka (IN-KA), India (IN).
Job Duties: Key Responsibilities: Conduct in-depth revenue analysis to identify trends and opportunities for growth. Perform P&L attribution, analyzing variances and providing detailed insights to stakeholders. Execute Independent Price Verification (IPV) processes to ensure the accuracy and consistency of financial data. Lead data reconciliation efforts by identifying and resolving discrepancies in financial datasets. Collaborate with finance, operations, and IT teams to develop efficient processes and reporting mechanisms. Document business requirements, workflows, and processes, translating them into technical specifications where necessary. Develop and maintain financial models to support decision-making processes. Monitor financial performance and prepare detailed reports for senior management. Minimum Skills Required: Qualifications: Bachelors degree in Finance, Economics, Business, or a related field (Master s preferred). Proven experience as a Business Analyst in the finance domain, with expertise in revenue, P&L attribution, IPV, and data reconciliation. Strong knowledge of financial principles, data analysis, and reporting tools. Proficiency in data analytics platforms such as Excel, SQL, or Tableau. Excellent problem-solving skills and attention to detail. Strong communication and interpersonal skills for effective stakeholder management. Ability to work in a fast-paced, deadline-driven environment. Preferred Skills: Certification in Business Analysis (e.g., CBAP, CCBA) or related field is a plus. Familiarity with financial systems and accounting software. Experience in Agile or Scrum methodologies.",Avg. salary - 4.7 LPA,"req id 
ntt data strives to hire exceptional innovative and passionate individuals who want to grow with us if you want to be part of an inclusive adaptable and forwardthinking organization apply now
we are currently seeking a data analyst to join our team in bangalore karn taka inka india in
job duties key responsibilities conduct indepth revenue analysis to identify trends and opportunities for growth perform pl attribution analyzing variances and providing detailed insights to stakeholders execute independent price verification ipv processes to ensure the accuracy and consistency of financial data lead data reconciliation efforts by identifying and resolving discrepancies in financial datasets collaborate with finance operations and it teams to develop efficient processes and reporting mechanisms document business requirements workflows and processes translating them into technical specifications where necessary develop and maintain financial models to support decisionmaking processes monitor financial performance and prepare detailed reports for senior management minimum skills required qualifications bachelors degree in finance economics business or a related field master s preferred proven experience as a business analyst in the finance domain with expertise in revenue pl attribution ipv and data reconciliation strong knowledge of financial principles data analysis and reporting tools proficiency in data analytics platforms such as excel sql or tableau excellent problemsolving skills and attention to detail strong communication and interpersonal skills for effective stakeholder management ability to work in a fastpaced deadlinedriven environment preferred skills certification in business analysis eg cbap ccba or related field is a plus familiarity with financial systems and accounting software experience in agile or scrum methodologies","['sql', 'excel', 'tableau', 'analytics']"
Data Governance Analyst,Barclays,"Pune, Chennai",https://www.naukri.com/job-listings-data-governance-analyst-barclays-shared-services-pune-chennai-0-to-7-years-100725502538,"Join us as a Data Governance Analyst at Barclays, where you will be responsible for supporting the successful delivery of location strategy projects to plan, budget, agreed quality and governance standards. Youll spearhead the evolution of our digital landscape, driving innovation and excellence. You will harness cutting-edge technology to revolutionise our digital offerings, ensuring unparalleled customer experiences.
To be successful as a Data Governance Analyst you should have experience with:
Data and Record governance, data controls, data lineage and associated methodologies.
Experience in data products, cloud and data warehouses
Business Domain (Retail or Banking) and Regulatory reporting experience.
Working in a regulated environment and solid understanding of data and control risk management.
Some other highly valued skills may include:
Understanding of different technologies around the execution of data control.
Ability to proactively drive change.
Exceptional stakeholder management skills to be able to maintain collaborative working relationships with key senior stakeholders.
Experience of working in multiple large teams delivering complex services involving the highest standards of resilience, risk and governance controls.
Proficiency in data analytics and insight generation to derive actionable insights from data.
You may be assessed on key critical skills relevant for success in role, such as risk and controls, change and transformation, business acumen, strategic thinking and digital and technology, as well as job-specific technical skills.
This role is based out of Chennai.
Purpose of the role
To develop, implement, and maintain effective governance frameworks for all data and records across the banks global operations.
Accountabilities
Development and maintenance of a comprehensive data and records governance framework aligned with regulatory requirements and industry standards.
Monitoring data quality and records metrics and compliance with standards across the organization.
Identification and addressing of data and records management risks and gaps.
Development and implementation of a records management programme that ensures the proper identification, classification, storage, retention, retrieval and disposal of records.
Development and implementation of a data governance strategy that aligns with the banks overall data management strategy and business objectives.
Provision of Group wide guidance and training on Data and Records Management standard requirements.
Assistant Vice President Expectations
To advise and influence decision making, contribute to policy development and take responsibility for operational effectiveness. Collaborate closely with other functions/ business divisions.
Lead a team performing complex tasks, using well developed professional knowledge and skills to deliver on work that impacts the whole business function. Set objectives and coach employees in pursuit of those objectives, appraisal of performance relative to objectives and determination of reward outcomes
If the position has leadership responsibilities, People Leaders are expected to demonstrate a clear set of leadership behaviours to create an environment for colleagues to thrive and deliver to a consistently excellent standard. The four LEAD behaviours are: L - Listen and be authentic, E - Energise and inspire, A - Align across the enterprise, D - Develop others.
OR for an individual contributor, they will lead collaborative assignments and guide team members through structured assignments, identify the need for the inclusion of other areas of specialisation to complete assignments. They will identify new directions for assignments and/ or projects, identifying a combination of cross functional methodologies or practices to meet required outcomes.
Consult on complex issues; providing advice to People Leaders to support the resolution of escalated issues.
Identify ways to mitigate risk and developing new policies/procedures in support of the control and governance agenda.
Take ownership for managing risk and strengthening controls in relation to the work done.
Perform work that is closely related to that of other areas, which requires understanding of how areas coordinate and contribute to the achievement of the objectives of the organisation sub-function.
Collaborate with other areas of work, for business aligned support areas to keep up to speed with business activity and the business strategy.
Engage in complex analysis of data from multiple sources of information, internal and external sources such as procedures and practises (in other areas, teams, companies, etc). to solve problems creatively and effectively.
Communicate complex information. Complex information could include sensitive information or information that is difficult to communicate because of its content or its audience.
Influence or convince stakeholders to achieve outcomes.",Not Mentioned,"join us as a data governance analyst at barclays where you will be responsible for supporting the successful delivery of location strategy projects to plan budget agreed quality and governance standards youll spearhead the evolution of our digital landscape driving innovation and excellence you will harness cuttingedge technology to revolutionise our digital offerings ensuring unparalleled customer experiences
to be successful as a data governance analyst you should have experience with
data and record governance data controls data lineage and associated methodologies
experience in data products cloud and data warehouses
business domain retail or banking and regulatory reporting experience
working in a regulated environment and solid understanding of data and control risk management
some other highly valued skills may include
understanding of different technologies around the execution of data control
ability to proactively drive change
exceptional stakeholder management skills to be able to maintain collaborative working relationships with key senior stakeholders
experience of working in multiple large teams delivering complex services involving the highest standards of resilience risk and governance controls
proficiency in data analytics and insight generation to derive actionable insights from data
you may be assessed on key critical skills relevant for success in role such as risk and controls change and transformation business acumen strategic thinking and digital and technology as well as jobspecific technical skills
this role is based out of chennai
purpose of the role
to develop implement and maintain effective governance frameworks for all data and records across the banks global operations
accountabilities
development and maintenance of a comprehensive data and records governance framework aligned with regulatory requirements and industry standards
monitoring data quality and records metrics and compliance with standards across the organization
identification and addressing of data and records management risks and gaps
development and implementation of a records management programme that ensures the proper identification classification storage retention retrieval and disposal of records
development and implementation of a data governance strategy that aligns with the banks overall data management strategy and business objectives
provision of group wide guidance and training on data and records management standard requirements
assistant vice president expectations
to advise and influence decision making contribute to policy development and take responsibility for operational effectiveness collaborate closely with other functions business divisions
lead a team performing complex tasks using well developed professional knowledge and skills to deliver on work that impacts the whole business function set objectives and coach employees in pursuit of those objectives appraisal of performance relative to objectives and determination of reward outcomes
if the position has leadership responsibilities people leaders are expected to demonstrate a clear set of leadership behaviours to create an environment for colleagues to thrive and deliver to a consistently excellent standard the four lead behaviours are l  listen and be authentic e  energise and inspire a  align across the enterprise d  develop others
or for an individual contributor they will lead collaborative assignments and guide team members through structured assignments identify the need for the inclusion of other areas of specialisation to complete assignments they will identify new directions for assignments and or projects identifying a combination of cross functional methodologies or practices to meet required outcomes
consult on complex issues providing advice to people leaders to support the resolution of escalated issues
identify ways to mitigate risk and developing new policiesprocedures in support of the control and governance agenda
take ownership for managing risk and strengthening controls in relation to the work done
perform work that is closely related to that of other areas which requires understanding of how areas coordinate and contribute to the achievement of the objectives of the organisation subfunction
collaborate with other areas of work for business aligned support areas to keep up to speed with business activity and the business strategy
engage in complex analysis of data from multiple sources of information internal and external sources such as procedures and practises in other areas teams companies etc to solve problems creatively and effectively
communicate complex information complex information could include sensitive information or information that is difficult to communicate because of its content or its audience
influence or convince stakeholders to achieve outcomes","['excel', 'analytics']"
Data Analyst,Randstad India,New Delhi(Siri Fort),https://www.naukri.com/job-listings-data-analyst-randstad-new-delhi-3-to-8-years-190625025311,"Hiring for Randstad client

Role & responsibilities

Requirement Gathering & Stakeholder Engagement- Collaborate with internal teams and logistics partners to understand business
problems, define KPIs, and translate them into data-driven requirements.
2. Data Exploration & Insight Generation - Analyze large, complex datasets using SQL to identify patterns, diagnose issues, and
uncover opportunities in hyperlocal and intercity logistics performance.
3. Dashboard Development & Reporting - Design and maintain Power BI dashboards and Excel-based reports that provide actionable
insights and enable real-time tracking of logistics KPIs.
4. Business Performance Monitoring - Track and evaluate critical metrics like TAT, fulfillment rate, and distance-based delivery
outcomes to measure operational efficiency across categories and cities.
5. Strategic Recommendations & Communication - Synthesize

Interested candidate share profile on p.preethi@randstad.in",Not Mentioned,"hiring for randstad client

role  responsibilities

requirement gathering  stakeholder engagement collaborate with internal teams and logistics partners to understand business
problems define kpis and translate them into datadriven requirements
 data exploration  insight generation  analyze large complex datasets using sql to identify patterns diagnose issues and
uncover opportunities in hyperlocal and intercity logistics performance
 dashboard development  reporting  design and maintain power bi dashboards and excelbased reports that provide actionable
insights and enable realtime tracking of logistics kpis
 business performance monitoring  track and evaluate critical metrics like tat fulfillment rate and distancebased delivery
outcomes to measure operational efficiency across categories and cities
 strategic recommendations  communication  synthesize

interested candidate share profile on ppreethirandstadin","['sql', 'excel', 'power bi', 'dash']"
