Job Title,Company,Location,Link,Description,Salary,Clean_Description,Skills
Data Analyst,Morningstar,Mumbai,https://www.naukri.com/job-listings-data-analyst-morningstar-india-p-ltd-mumbai-1-to-6-years-170725503558,"Data Analysts
Morningstar is looking for Data Analysts, an entry-level opportunity to join our Data and Operations group. This role will help you gain practical experience by working with diverse datasets, including public equity filings, private market transactions, ESG taxonomies, Managed Investment Data (Funds), and reference entity data. Youll build your knowledge about investment management, grow your skills in Excel, SQL, and Power BI, and benefit from structured training to support your growth, setting you up for long-term success.
This position will be permanently based in our Mumbai office; therefore, preference will be given to candidates residing in Mumbai. Candidates in this role may need to work in rotational shifts, including night shifts.
How does a typical day at work look
Search, collect and verify data of basic and intermediate levels of complexity
Attend to internal/client queries and requests to ensure data captured is aligned with data methodologies and policy guidelines
Quickly learn our research methods and process standards to ensure productivity, quality and timeliness
Collaborate with your team, cross-functional and external (if required) parties to resolve data issues.
You also get opportunities to innovate and improve processes/tools or participate in stretch projects and/or tasks besides your core responsibilities.
You might be a good fit if you -
Hold a Bachelor s degree (preferably in finance) with 60% marks
Demonstrate English communication skills (written/oral/comprehension)
Are proficient in MS Office tools, especially Excel and Word
Learn quickly and process with ease
Possesses attention to detail, a proactive mindset, and natural curiosity
Effectively prioritize tasks and perform well under tight deadlines
The role is open to fresh graduates as well as professionals with up to 1 year of experience.
How does it work
Once you apply to this role, here is how the hiring process looks -
Online Assessment - This includes sections on domain knowledge(finance), cognitive ability, English language, and a typing test.
Candidate Information Session - For those who clear the assessment, a session will be conducted to give an overview of Morningstar, our business areas, and what you can expect after joining.
Interviews - Shortlisted candidates will go through two rounds of interviews. This is also your opportunity to ask any questions and learn more from our interviewers.
Please note, only shortlisted candidates will be contacted by the Morningstar recruitment team.
Work Location : Vashi, Navi Mumbai.
Month of Joining: Aug 2025
What You Can Expect From Us
Find your passion through development, not just a job. As an Early Career hire, you will receive development through hands-on experience, stretch projects, mentoring, and career development workshops.
Meaning, belonging, and flexibility - At Morningstar, we want you to bring your whole self to work. Individual flexibility and the ability to make choices that support work-life integration are central to our culture and operational practices.
Work Schedule & Shifts - At Morningstar, we foster a strong in-office culture because we believe collaboration and innovation thrive when we are together. Our current Workplace Flexibility Policy allows employees to work remotely up to two days per week, providing a balance between flexibility and in-person engagement. Given that most business units operate in rotational shifts, you are required to demonstrate flexibility in working across different shifts. Shift allowances will be provided as a recognition of your adaptability and commitment.
At Morningstar, your talents are recognized because people are our most important assets. Across our offices worldwide, weve invested in fostering a community where your voice is heard, your ideas matter, and your contributions are rewarded.
About Morningstar
Morningstar is a global leader in independent investment research, supporting investors in over 32 countries with $300+ billion assets under management. Our mission is to empower investor success through data, research, and technology.
We build products and offer services that connect people to the investing information and the tools that they need. We are built on the principles of independence, transparency, and long-term thinking. By empowering investor success, we are constantly looking for new ways to help people achieve financial security.
Morningstar is an equal-opportunity employer.",Not Mentioned,"data analysts
morningstar is looking for data analysts an entrylevel opportunity to join our data and operations group this role will help you gain practical experience by working with diverse datasets including public equity filings private market transactions esg taxonomies managed investment data funds and reference entity data youll build your knowledge about investment management grow your skills in excel sql and power bi and benefit from structured training to support your growth setting you up for longterm success
this position will be permanently based in our mumbai office therefore preference will be given to candidates residing in mumbai candidates in this role may need to work in rotational shifts including night shifts
how does a typical day at work look
search collect and verify data of basic and intermediate levels of complexity
attend to internalclient queries and requests to ensure data captured is aligned with data methodologies and policy guidelines
quickly learn our research methods and process standards to ensure productivity quality and timeliness
collaborate with your team crossfunctional and external if required parties to resolve data issues
you also get opportunities to innovate and improve processestools or participate in stretch projects andor tasks besides your core responsibilities
you might be a good fit if you 
hold a bachelor s degree preferably in finance with  marks
demonstrate english communication skills writtenoralcomprehension
are proficient in ms office tools especially excel and word
learn quickly and process with ease
possesses attention to detail a proactive mindset and natural curiosity
effectively prioritize tasks and perform well under tight deadlines
the role is open to fresh graduates as well as professionals with up to  year of experience
how does it work
once you apply to this role here is how the hiring process looks 
online assessment  this includes sections on domain knowledgefinance cognitive ability english language and a typing test
candidate information session  for those who clear the assessment a session will be conducted to give an overview of morningstar our business areas and what you can expect after joining
interviews  shortlisted candidates will go through two rounds of interviews this is also your opportunity to ask any questions and learn more from our interviewers
please note only shortlisted candidates will be contacted by the morningstar recruitment team
work location  vashi navi mumbai
month of joining aug 
what you can expect from us
find your passion through development not just a job as an early career hire you will receive development through handson experience stretch projects mentoring and career development workshops
meaning belonging and flexibility  at morningstar we want you to bring your whole self to work individual flexibility and the ability to make choices that support worklife integration are central to our culture and operational practices
work schedule  shifts  at morningstar we foster a strong inoffice culture because we believe collaboration and innovation thrive when we are together our current workplace flexibility policy allows employees to work remotely up to two days per week providing a balance between flexibility and inperson engagement given that most business units operate in rotational shifts you are required to demonstrate flexibility in working across different shifts shift allowances will be provided as a recognition of your adaptability and commitment
at morningstar your talents are recognized because people are our most important assets across our offices worldwide weve invested in fostering a community where your voice is heard your ideas matter and your contributions are rewarded
about morningstar
morningstar is a global leader in independent investment research supporting investors in over  countries with  billion assets under management our mission is to empower investor success through data research and technology
we build products and offer services that connect people to the investing information and the tools that they need we are built on the principles of independence transparency and longterm thinking by empowering investor success we are constantly looking for new ways to help people achieve financial security
morningstar is an equalopportunity employer","['sql', 'excel', 'power bi']"
Data Analyst - Off Roll,Royal Enfield,Chennai,https://www.naukri.com/job-listings-data-analyst-off-roll-royal-enfield-chennai-1-to-2-years-150725025159,"Job Summary:
The organization seeks a highly motivated and analytical Data Analyst to join the
team. The ideal candidate will be passionate about using data to drive business
decisions and improve processes. Responsibilities include collecting, cleaning,
analyzing, and interpreting complex datasets, providing actionable insights to various
stakeholders across the organization.

Key Responsibilities:",Avg. salary - 5.8 LPA,"job summary
the organization seeks a highly motivated and analytical data analyst to join the
team the ideal candidate will be passionate about using data to drive business
decisions and improve processes responsibilities include collecting cleaning
analyzing and interpreting complex datasets providing actionable insights to various
stakeholders across the organization

key responsibilities",[]
Data Analyst,Simplilearn,Bengaluru,https://www.naukri.com/job-listings-data-analyst-simplilearn-bengaluru-2-to-5-years-170725015878,"Position - Data Analyst/Senior Data Analyst
Location: Bengaluru

About Simplilearn
Simplilearn is the world's #1 online bootcamp providing digital skills training to help individuals acquire the skills they need to thrive in the digital economy. We provide rigorous online training in disciplines such as Cyber Security, Cloud Computing, Project Management, Digital Marketing, and Data Science, among others. In other words, we specialize in areas where technologies and best practices are changing rapidly, and the demand for qualified candidates significantly exceeds supply.
Designed and continually updated by 2000+ renowned industry and academic experts, we offer a choice of individual courses, comprehensive certification programs, and partnerships with some world-renowned universities, helping millions of professionals with work-ready skills they need to excel in their career, and thousands of organizations with their corporate training and employee upskilling needs. Our practical and applied approach has resulted in 85 percent of learners getting promotions or new jobs. Learn by doing over 1,000 live classes each month, real-world projects, and more. Experience the new way of learning at Simplilearn.
Our analytics team is composed of talented and driven problem-solvers. We never stop learning, we teach one another, and we take immense pride in our work. We are looking for someone to join our top-notch Analytics team.

What Youll Do
Define key metrics for the various domains including business, marketing, website and post purchase (Engagement, Completion, Experience etc) that would help the FSA Team streamline their operations and drive improvements.
Understand the strategic roadmap of business stakeholders and support them in achieving the targets.
Collaborate with FSA team, Data Engineering team to support strategic growth initiatives
Develop, maintain, and optimize Tableau dashboards for business stakeholders
Monitor key metrics in both B2B and B2C. Understand the nuances of each domain and create ADS that cater the business requirements.
Complete ownership of the assigned tasks from gathering requirements, building robust and scalable solutions, driving consumption, and generating business insights.

We'd Like You to Have
Bachelors degree from a tier I institute with strong problem-solving skills.
2-4 years of experience in analytics at a fast-paced product organization.
Should be proficient in working on relational databases SQL.
Extensive hand-on experience of data visualization to create insightful dashboards using Tableau
Should have worked on aggregating data from multiple data sources and data wrangling using R/Python.
Excellent written and verbal communication skills

Behavioral attributes
- We are looking for hustlers in the Analytics team who know how to get the job done.
- If you have the ability to hunt for simplification in complexity, we would love to talk to you.
- If you have an entrepreneurial spirit and you know how to take complete ownership of your work, we would be interested in you.",Not Mentioned,"position  data analystsenior data analyst
location bengaluru

about simplilearn
simplilearn is the worlds  online bootcamp providing digital skills training to help individuals acquire the skills they need to thrive in the digital economy we provide rigorous online training in disciplines such as cyber security cloud computing project management digital marketing and data science among others in other words we specialize in areas where technologies and best practices are changing rapidly and the demand for qualified candidates significantly exceeds supply
designed and continually updated by  renowned industry and academic experts we offer a choice of individual courses comprehensive certification programs and partnerships with some worldrenowned universities helping millions of professionals with workready skills they need to excel in their career and thousands of organizations with their corporate training and employee upskilling needs our practical and applied approach has resulted in  percent of learners getting promotions or new jobs learn by doing over  live classes each month realworld projects and more experience the new way of learning at simplilearn
our analytics team is composed of talented and driven problemsolvers we never stop learning we teach one another and we take immense pride in our work we are looking for someone to join our topnotch analytics team

what youll do
define key metrics for the various domains including business marketing website and post purchase engagement completion experience etc that would help the fsa team streamline their operations and drive improvements
understand the strategic roadmap of business stakeholders and support them in achieving the targets
collaborate with fsa team data engineering team to support strategic growth initiatives
develop maintain and optimize tableau dashboards for business stakeholders
monitor key metrics in both bb and bc understand the nuances of each domain and create ads that cater the business requirements
complete ownership of the assigned tasks from gathering requirements building robust and scalable solutions driving consumption and generating business insights

wed like you to have
bachelors degree from a tier i institute with strong problemsolving skills
 years of experience in analytics at a fastpaced product organization
should be proficient in working on relational databases sql
extensive handon experience of data visualization to create insightful dashboards using tableau
should have worked on aggregating data from multiple data sources and data wrangling using rpython
excellent written and verbal communication skills

behavioral attributes
 we are looking for hustlers in the analytics team who know how to get the job done
 if you have the ability to hunt for simplification in complexity we would love to talk to you
 if you have an entrepreneurial spirit and you know how to take complete ownership of your work we would be interested in you","['python', 'sql', 'excel', 'tableau', 'data visualization', 'analytics', 'dash']"
Data Analyst - Havells IP,Havells,"Prayagraj, Varanasi, Ghaziabad, Kanpur, Lucknow, Agra",https://www.naukri.com/job-listings-data-analyst-havells-ip-havells-india-limited-prayagraj-varanasi-ghaziabad-kanpur-lucknow-agra-0-to-6-years-150725504958,"Having knowledge of Advance Excel, Power BI, VBA and Other Dashboard/ Visualization
Tool set for Data Intelligence and analysis.
Handle All the Region Wise Reports As Territory Wise Business performance Report,
Regional Allowance - Report With the help of SAP.
Prepare PPT to Performance Report for higher management presentation (Sale & Margin
Flow & Inventory Status)
Month/Quarterly/Half yearly/Annual sales/product reporting.
Preparing and flashing Daily/Weekly/Monthly/YTD reports to management, tracking
progress and analysis.
Visualization of Sales Analysis: - Prepare Dashboards, Depot wise Target vs. Actual Sale
data on Pan India basis.
Review and Analysis of various discounts and marketing schemes as prevailing and
proposed for various regions with the schemes of local competitors.",Avg. salary - 5.8 LPA,"having knowledge of advance excel power bi vba and other dashboard visualization
tool set for data intelligence and analysis
handle all the region wise reports as territory wise business performance report
regional allowance  report with the help of sap
prepare ppt to performance report for higher management presentation sale  margin
flow  inventory status
monthquarterlyhalf yearlyannual salesproduct reporting
preparing and flashing dailyweeklymonthlyytd reports to management tracking
progress and analysis
visualization of sales analysis  prepare dashboards depot wise target vs actual sale
data on pan india basis
review and analysis of various discounts and marketing schemes as prevailing and
proposed for various regions with the schemes of local competitors","['excel', 'power bi', 'dash']"
